{
  "kind": "fork-register",
  "register_version": 1,
  "subject": "regcf",
  "note": "Interpretive forks in the COMMITTED corpus (regcf.l4). Distinct from jl4/examples/legal/regcf/denovo/fork-register.json, which registers 26 forks found by the independent de novo encoding of the same Part and describes a different file — do not merge the two without re-deriving each entry against the file it names. Every entry here was already argued in prose before it was registered: F-501A-ENDPOINT and F-4A6B-MEASURE in README.md §5 and §3, F-501A-LEAPDAY in README.md §5.2 as of 2026-08-05. Registering them changes nothing about the encoding; it moves the disclosure from prose a drafter chose to write into structure the explainer renders whether or not anyone remembers. Three more (F-501A4-NEXUS, F-501A4-DETERMINER, F-501A4-SIMILAR) were added 2026-08-09 when Rule 501(a)(4) stopped being one ~300-character boolean and became six fields; all three were forced by the split and none of them could have been asked while the limb was one self-assessed fact. COMPLETENESS IS UNFALSIFIABLE: no procedure enumerates the ambiguities a statute contains, so seven entries here is not a claim that there are seven.",
  "entries": [
    {
      "id": "F-501A-LEAPDAY",
      "kind": "fact-convention",
      "materialisation": "resolved-at-encode",
      "site": {
        "file": "jl4/examples/legal/regcf/regcf.l4",
        "anchor": "`the first anniversary of the issuance`",
        "provisions": [
          "17 CFR 227.501(a)"
        ]
      },
      "source": {
        "quote": "during the one-year period beginning when the securities were issued",
        "citations": [
          {
            "kind": "provision",
            "cite": "17 CFR 227.501(a)",
            "url": "https://www.ecfr.gov/current/title-17/section-227.501"
          }
        ]
      },
      "readings": [
        {
          "id": "clamp",
          "description": "One year after 29 February 2024 is 28 February 2025 — the anniversary clamps back to the last day of the corresponding month when the original day does not exist in it.",
          "status": "live",
          "citations": [
            {
              "kind": "provision",
              "cite": "17 CFR 227.501(a)"
            }
          ]
        },
        {
          "id": "rollForward",
          "description": "One year after 29 February 2024 is 1 March 2025 — the period runs a full year and lands on the next day that exists, so the restriction is one day longer.",
          "status": "live",
          "citations": [
            {
              "kind": "provision",
              "cite": "17 CFR 227.501(a)"
            }
          ]
        }
      ],
      "taken": {
        "reading": "clamp",
        "mechanism": "encoded",
        "rationale": "Taken because it is what the target systems already do, so the L4 answer and every exported answer agree by construction rather than by care. MEASURED 2026-08-05: `daydate`'s `add years` clamps, Excel's EDATE clamps, and FEEL's `date + duration(\"P1Y\")` returns 2025-02-28 on both Drools/KIE 8.44.0.Final and Camunda 8.7.6. The rejected reading is not wrong as law — a court could plainly hold that a one-year period from 29 February ends on 1 March — it is simply not the reading any engine implements, and an encoding that took it would answer differently from its own DMN export. Note the third possibility that is NOT a reading of the law but a defect: reconstructing the date as `date(y + 1, m, d)` yields null on both engines, because 29 February 2025 is not a date at all."
      },
      "status": "open",
      "divergence": "observable",
      "witnesses": [
        "A transfer of securities issued 2024-02-29 and transferred 2025-02-28 is OUTSIDE the restricted period under `clamp` and INSIDE it under `rollForward`. One day, one holding in roughly four."
      ],
      "cross_refs": [
        "F-501A-ENDPOINT"
      ],
      "notes": [
        "This fork became visible only when the encoding stopped carrying an elapsed day count and started carrying dates. While `Transfer` held `days since the securities were issued`, the question could not be asked in the corpus's own vocabulary."
      ]
    },
    {
      "id": "F-501A-ENDPOINT",
      "kind": "statutory-wording",
      "materialisation": "resolved-at-encode",
      "site": {
        "file": "jl4/examples/legal/regcf/regcf.l4",
        "anchor": "`transfer is within the one-year restricted period`",
        "provisions": [
          "17 CFR 227.501(a)"
        ]
      },
      "source": {
        "quote": "during the one-year period beginning when the securities were issued",
        "citations": [
          {
            "kind": "provision",
            "cite": "17 CFR 227.501(a)",
            "url": "https://www.ecfr.gov/current/title-17/section-227.501"
          }
        ]
      },
      "readings": [
        {
          "id": "halfOpen",
          "description": "The first anniversary is OUTSIDE the period: a transfer on the anniversary itself is free. The interval is [issuance, first anniversary).",
          "status": "live",
          "citations": [
            {
              "kind": "provision",
              "cite": "17 CFR 227.501(a)"
            }
          ]
        },
        {
          "id": "closed",
          "description": "The first anniversary is INSIDE the period: a transfer on the anniversary is still restricted, and freedom begins the following day.",
          "status": "live",
          "citations": [
            {
              "kind": "provision",
              "cite": "17 CFR 227.501(a)"
            }
          ]
        }
      ],
      "taken": {
        "reading": "halfOpen",
        "mechanism": "encoded",
        "rationale": "Taken as the ordinary reading of a period that BEGINS on a date: the period contains its start and not its end, as a one-year lease from 1 June ends before 1 June. The rule does not decide it, and NO ENCODING CAN — this is not a gap in the formalisation but an underdetermination in the source. A drafter could remove the question in four words; a reader who cares must litigate it."
      },
      "status": "open",
      "divergence": "observable",
      "witnesses": [
        "A transfer exactly on the first anniversary is permitted under `halfOpen` and prohibited under `closed`. Asserted both ways in regcf.l4's leap-case block."
      ],
      "cross_refs": [
        "F-501A-LEAPDAY"
      ],
      "notes": [
        "Unlike F-501A-LEAPDAY, this one has no engine-convention tiebreak available: the target systems have nothing to say about which endpoint a statute means."
      ]
    },
    {
      "id": "F-4A6B-MEASURE",
      "kind": "statutory-wording",
      "materialisation": "resolved-at-encode",
      "site": {
        "file": "jl4/examples/legal/regcf/regcf.l4",
        "anchor": "`the applicable measure of annual income or net worth`",
        "provisions": [
          "17 CFR 227.100(a)(2)(i)",
          "17 CFR 227.100(a)(2)(ii)",
          "15 U.S.C. 77d(a)(6)(B)"
        ]
      },
      "source": {
        "quote": "the greater of $2,500, or 5 percent of the greater of the investor's annual income or net worth",
        "citations": [
          {
            "kind": "provision",
            "cite": "17 CFR 227.100(a)(2)(i)",
            "url": "https://www.ecfr.gov/current/title-17/section-227.100"
          }
        ]
      },
      "readings": [
        {
          "id": "greaterOf",
          "description": "The limit is computed on the GREATER of annual income and net worth — the rule as amended in 2021.",
          "status": "live",
          "citations": [
            {
              "kind": "instrument",
              "cite": "86 FR 3496 (Rel. 33-10884)"
            }
          ]
        },
        {
          "id": "lesserOf",
          "description": "The limit is computed on the LESSER of the two — the rule as originally adopted, and what the statute's own text at 15 U.S.C. 77d(a)(6)(B) still says.",
          "status": "live",
          "citations": [
            {
              "kind": "provision",
              "cite": "15 U.S.C. 77d(a)(6)(B)"
            },
            {
              "kind": "instrument",
              "cite": "80 FR 71388 (Rel. 33-9974)"
            }
          ]
        }
      ],
      "taken": {
        "reading": "greaterOf",
        "mechanism": "encoded",
        "rationale": "Taken for rule dates from 2021-03-15 because the regulation says so, and the corpus's rule-version axis carries `lesserOf` for earlier dates rather than discarding it — so both readings are live and selected by date rather than one being deleted. What the encoding does NOT resolve is that neither reading was ever compelled: Securities Act § 4(a)(6)(B) (15 U.S.C. 77d(a)(6)(B)) says only 'a given percentage of the annual income or net worth of such investor, as applicable', specifying neither measure, and the Commission itself notes that '[t]he statutory language does not expressly provide that the investor use the lesser of annual income or net worth' (86 FR 3496, n.460). So the operative word is a discretionary regulatory gloss held for five years and then reversed — not a conflict with the statute. CORRECTED 2026-08-06: this rationale previously read 'the statute the regulation implements still reads lesser of', which is false — the phrase appears nowhere in § 77d — and regcf.l4:394-403 had it right all along. The false form was copied out of here into three pipeline documents before it was caught."
      },
      "status": "open",
      "divergence": "observable",
      "witnesses": [
        "An investor with $110,000 income and $115,000 net worth gets a different limit under each reading; both are exercised by the committed relocation cases in regcf-corpus.cases.json."
      ],
      "cross_refs": [],
      "notes": [